{
  "id": 9228,
  "key": "Earth",
  "title": "Earth",
  "excerpt": "Earth is the third planet from the Sun and the only astronomical object known to harbor life.",
  "matched_title": "Earth",
  "description": "Brief encyclopedic description.",
  "thumbnail": {
    "url": "https://en.wikipedia.org/wiki/Earth",
    "width": 9228,
    "height": 720,
    "mimetype": "image/jpeg"
  }
}